subject,exam_board,level,title,parent_title,order_index
History,AQA,2,"Society in Crisis, 1906–1929","2M Wars and Welfare: Britain in Transition, 1906–1957",1
History,AQA,3,"The Liberal Governments, 1906–1914","Society in Crisis, 1906–1929",1
History,AQA,3,Pre-War Crises and the Impact of War,"Society in Crisis, 1906–1929",2
History,AQA,3,The Social and Economic Impact of War,"Society in Crisis, 1906–1929",3
History,AQA,3,Britain in the 1920s,"Society in Crisis, 1906–1929",4
History,AQA,2,"The Emergence of the Affluent Society, 1929–1957","2M Wars and Welfare: Britain in Transition, 1906–1957",2
History,AQA,3,Britain in the ‘Hungry Thirties’,"The Emergence of the Affluent Society, 1929–1957",1
History,AQA,3,The ‘People’s War’ and the Post-War Settlement,"The Emergence of the Affluent Society, 1929–1957",2
History,AQA,3,The Age of Affluence: Politics and Economy,"The Emergence of the Affluent Society, 1929–1957",3
History,AQA,3,The Affluent Society: Social Change and Tensions,"The Emergence of the Affluent Society, 1929–1957",4
History,AQA,1,"2N Revolution and dictatorship: Russia, 1917–1953",,24
History,AQA,2,"The Russian Revolution and the Rise of Stalin, 1917","2N Revolution and dictatorship: Russia, 1917–1953",1
History,AQA,3,The Revolutions of 1917,"The Russian Revolution and the Rise of Stalin, 1917",1
History,AQA,3,"Consolidation, Civil War, and the NEP","The Russian Revolution and the Rise of Stalin, 1917",2
History,AQA,3,The Power Struggle and Stalin’s Rise,"The Russian Revolution and the Rise of Stalin, 1917",3
History,AQA,3,The ‘Great Turn’ and the Stalinist State,"The Russian Revolution and the Rise of Stalin, 1917",4
History,AQA,2,"Stalin’s Rule, 1929–1953 (A-level only)","2N Revolution and dictatorship: Russia, 1917–1953",2
History,AQA,3,Stalin’s Revolution from Above,"Stalin’s Rule, 1929–1953 (A-level only)",1
History,AQA,3,The Terror State,"Stalin’s Rule, 1929–1953 (A-level only)",2
History,AQA,3,The Great Patriotic War,"Stalin’s Rule, 1929–1953 (A-level only)",3
History,AQA,3,High Stalinism and Legacy,"Stalin’s Rule, 1929–1953 (A-level only)",4
History,AQA,1,"2O Democracy and Nazism: Germany, 1918–1945",,25
History,AQA,2,"The Weimar Republic, 1918–1933","2O Democracy and Nazism: Germany, 1918–1945",1
History,AQA,3,"The Troubled Birth of the Republic, 1918–1924","The Weimar Republic, 1918–1933",1
History,AQA,3,"The ‘Golden Age’ of Weimar, 1924–1929","The Weimar Republic, 1918–1933",2
History,AQA,3,"The Collapse of the Republic, 1929–1933","The Weimar Republic, 1918–1933",3
History,AQA,3,Hitler’s Appointment as Chancellor,"The Weimar Republic, 1918–1933",4
History,AQA,2,"Nazi Germany, 1933–1945 (A-level only)","2O Democracy and Nazism: Germany, 1918–1945",2
History,AQA,3,Consolidating Power and the Terror State,"Nazi Germany, 1933–1945 (A-level only)",1
History,AQA,3,Nazi Economic and Social Policies,"Nazi Germany, 1933–1945 (A-level only)",2
History,AQA,3,Racial Policy and the Holocaust,"Nazi Germany, 1933–1945 (A-level only)",3
History,AQA,3,The Impact of War on Nazi Germany,"Nazi Germany, 1933–1945 (A-level only)",4
History,AQA,1,"2P The Transformation of China, 1936–1997",,26
History,AQA,2,"The Emergence of the People’s Republic of China, 1","2P The Transformation of China, 1936–1997",1
History,AQA,3,"The GMD, CCP, and the Sino-Japanese War","The Emergence of the People’s Republic of China, 1",1
History,AQA,3,The Chinese Civil War and Communist Victory,"The Emergence of the People’s Republic of China, 1",2
History,AQA,3,Consolidating Communist Rule,"The Emergence of the People’s Republic of China, 1",3
History,AQA,3,The Great Leap Forward and its Consequences,"The Emergence of the People’s Republic of China, 1",4
History,AQA,2,Economic Growth and the Transformation of the St,"2P The Transformation of China, 1936–1997",2
History,AQA,3,China after the Great Leap Forward,Economic Growth and the Transformation of the St,1
History,AQA,3,The Cultural Revolution: Origins and Development,Economic Growth and the Transformation of the St,2
History,AQA,3,The Impact of the Cultural Revolution and Foreign,Economic Growth and the Transformation of the St,3
History,AQA,3,The Deng Xiaoping Era and Modern China,Economic Growth and the Transformation of the St,4
History,AQA,1,"2Q The American Dream: reality and illusion, 1945–1980",,27
History,AQA,2,"Prosperity, Inequality and Superpower Status, 1945–","2Q The American Dream: reality and illusion, 1945–1980",1
History,AQA,3,The Truman Presidency and the Early Cold War,"Prosperity, Inequality and Superpower Status, 1945–",1
History,AQA,3,The Eisenhower Presidency and the Affluent Socie,"Prosperity, Inequality and Superpower Status, 1945–",2
History,AQA,3,The Kennedy Presidency and the ‘New Frontier’,"Prosperity, Inequality and Superpower Status, 1945–",3
History,AQA,3,The Civil Rights Movement to 1963,"Prosperity, Inequality and Superpower Status, 1945–",4
History,AQA,2,"Challenges to the American Dream, 1963–1980 (A-","2Q The American Dream: reality and illusion, 1945–1980",2
History,AQA,3,The Johnson Presidency: ‘Great Society’ and Viet,"Challenges to the American Dream, 1963–1980 (A-",1
History,AQA,3,Social Division and Protest in the 1960s,"Challenges to the American Dream, 1963–1980 (A-",2
History,AQA,3,The Nixon Presidency and Watergate,"Challenges to the American Dream, 1963–1980 (A-",3
History,AQA,3,"The USA after Watergate: Ford, Carter and the ‘Ne","Challenges to the American Dream, 1963–1980 (A-",4
History,AQA,1,"2R The Cold War, c1945–1991",,28
History,AQA,2,To the Brink of Nuclear War: International Relations,"2R The Cold War, c1945–1991",1
History,AQA,3,The Origins and Development of the Cold War,To the Brink of Nuclear War: International Relations,1
History,AQA,3,The Cold War in Europe and Asia,To the Brink of Nuclear War: International Relations,2
History,AQA,3,The ‘New Look’ and Peaceful Coexistence,To the Brink of Nuclear War: International Relations,3
History,AQA,3,Superpower Confrontation in the Kennedy Era,To the Brink of Nuclear War: International Relations,4
History,AQA,2,"From Détente to the End of the Cold War, c1963–19","2R The Cold War, c1945–1991",2
History,AQA,3,The Vietnam War and Superpower Relations,"From Détente to the End of the Cold War, c1963–19",1
History,AQA,3,The Era of Détente,"From Détente to the End of the Cold War, c1963–19",2
History,AQA,3,The Second Cold War,"From Détente to the End of the Cold War, c1963–19",3
History,AQA,3,The End of the Cold War,"From Détente to the End of the Cold War, c1963–19",4
History,AQA,1,"2S The Making of Modern Britain, 1951–2007",,29
History,AQA,2,"Building a New Britain, 1951–1979","2S The Making of Modern Britain, 1951–2007",1
History,AQA,3,"The Affluent Society, 1951–1964","Building a New Britain, 1951–1979",1
History,AQA,3,The ‘Swinging Sixties’: Labour in Power,"Building a New Britain, 1951–1979",2
History,AQA,3,Society and Foreign Relations in the 1960s,"Building a New Britain, 1951–1979",3
History,AQA,3,"The End of the Post-War Consensus, 1970–1979","Building a New Britain, 1951–1979",4
History,AQA,2,"Modern Britain, 1979–2007 (A-level only)","2S The Making of Modern Britain, 1951–2007",2
History,AQA,3,The Thatcher Revolution: Politics and Economy,"Modern Britain, 1979–2007 (A-level only)",1
History,AQA,3,Thatcherism: Society and Foreign Policy,"Modern Britain, 1979–2007 (A-level only)",2
History,AQA,3,The Major Years and the Rise of New Labour,"Modern Britain, 1979–2007 (A-level only)",3
History,AQA,3,"New Labour in Power, 1997–2007","Modern Britain, 1979–2007 (A-level only)",4
History,AQA,1,"2T The Crisis of Communism: The USSR and the Soviet Empire, 1953–2000 (A-level only)",,30
History,AQA,2,"Crisis in the Soviet Union, 1953–2000","2T The Crisis of Communism: The USSR and the Soviet Empire, 1953–2000 (A-level only)",1
History,AQA,3,The Khrushchev Era: De-Stalinisation and Reform,"Crisis in the Soviet Union, 1953–2000",1
History,AQA,3,The Brezhnev Era: Stagnation and Détente,"Crisis in the Soviet Union, 1953–2000",2
History,AQA,3,The Gorbachev Era: Reform and Collapse,"Crisis in the Soviet Union, 1953–2000",3
History,AQA,3,The End of the USSR and Post-Soviet Russia,"Crisis in the Soviet Union, 1953–2000",4
History,AQA,2,"Crisis in the Soviet Empire, 1953–2000","2T The Crisis of Communism: The USSR and the Soviet Empire, 1953–2000 (A-level only)",2
History,AQA,3,Life and Repression in the Satellite States,"Crisis in the Soviet Empire, 1953–2000",1
History,AQA,3,Challenges to Soviet Control up to 1980,"Crisis in the Soviet Empire, 1953–2000",2
History,AQA,3,The Collapse of Communism in Eastern Europe,"Crisis in the Soviet Empire, 1953–2000",3
History,AQA,3,The Post-Soviet Era in Eastern and Central Europ,"Crisis in the Soviet Empire, 1953–2000",4